addrReg,addrWork,area,ename,industry,institutional,is_target,listingDate,lootchips,market,name,offerDate,pricelimit,registerDate,shareholders,sname,stockCode,webSite
福建省厦门市海沧新阳工业区,福建省厦门市海沧新阳工业区阳光西路299号,福建,Xiamen Kingdomway Group Company,食品生产（IV）,61648.19,1.0,2011-10-27 16:00:00,5.76,中小企业板,厦门金达威集团股份有限公司,2011-10-18 16:00:00,6.16,1997-11-23 16:00:00,92.6,金达威,002626,http://www.kingdomway.com
河北省石家庄市和平东路388号,河北省石家庄市和平东路388号,河北,"North China Pharmaceutical Co., Ltd.",制药,163080.47,1.0,1994-01-13 16:00:00,13.79,上海证券交易所,华北制药股份有限公司,,16.31,1992-08-24 16:00:00,92.5,华北制药,600812,http://www.ncpc.com
广西壮族自治区贺州市平安西路12号,广西壮族自治区贺州市平安西路12号,广西,"Guangxi Guidong Electric Power Co., Ltd.",电力（IV）,82777.5,1.0,2001-02-27 16:00:00,8.28,上海证券交易所,广西桂东电力股份有限公司,2001-01-11 16:00:00,8.28,1998-12-03 16:00:00,92.21,桂东电力,600310,http://www.gdep.com.cn
河北省保定市天威西路2222号,河北省保定市天威西路2222号,河北,"Baoding Tianwei Baobian Electric Co., Ltd.",电子电气组件与设备,153460.71,1.0,2001-02-27 16:00:00,13.73,上海证券交易所,保定天威保变电气股份有限公司,2001-01-11 16:00:00,15.35,1999-09-27 16:00:00,92.13,保变电气,600550,http://www.twbb.com
湖北省襄阳市长虹北路67号,陕西省西安市长乐中路35号,湖北,"North Electro-optic Co., Ltd.",电子电气组件与设备,50876.08,1.0,2003-11-05 16:00:00,4.19,上海证券交易所,北方光电股份有限公司,,5.09,2000-08-30 16:00:00,92.13,光电股份,600184,http://www.sicong.com
福建省厦门市海沧区新园路99号,福建省厦门市海沧区新园路99号,福建,"Xiamen Faratronic Co., Ltd.",电子电气组件与设备,22500.0,1.0,2002-12-09 16:00:00,2.25,上海证券交易所,厦门法拉电子股份有限公司,,2.25,1998-12-11 16:00:00,92.07,法拉电子,600563,http://www.faratronic.com
江苏省苏州市国家高新技术产业开发区浒关工业园,江苏省苏州市新区珠江路501号,江苏,"SUFA Technology Industry Co., Ltd., CNNC",工业机械,38341.76,1.0,1997-07-09 16:00:00,3.83,深圳证券交易所,中核苏阀科技实业股份有限公司,1997-06-15 16:00:00,3.83,1997-07-01 16:00:00,91.97,中核科技,000777,http://www.chinasufa.com
新疆维吾尔自治区乌鲁木齐经济技术开发区融合南路661号,新疆维吾尔自治区乌鲁木齐市新市区北京北路239号,新疆,"Xinjiang Machinery Research Institute Co., Ltd.",工业机械,149036.02,1.0,2011-01-06 16:00:00,5.28,创业板,新疆机械研究院股份有限公司,2010-12-26 16:00:00,14.9,2009-07-20 16:00:00,91.63,新研股份,300159,http://www.xjjxy.com.cn
山东省青岛市黄岛区茂山路588号,山东省青岛市四方区郑州路43号橡胶谷B栋,山东,"SAILUN JINYU GROUP CO.,LTD.",轮胎,229393.72,1.0,2011-06-29 16:00:00,22.17,上海证券交易所,赛轮金宇集团股份有限公司,2011-06-21 16:00:00,22.94,2002-11-17 16:00:00,91.54,赛轮金宇,601058,http://www.sailuntyre.com.cn
中国浙江省诸暨市店口工业区,浙江省杭州市滨江区滨安路1190号智汇领地科技园B座,浙江,"Zhejiang Dun'an Artificial Environment Co., Ltd.",工业机械,91721.22,1.0,2004-07-04 16:00:00,8.4,中小企业板,浙江盾安人工环境股份有限公司,,9.17,2001-12-18 16:00:00,91.45,盾安环境,002011,http://www.dunan.net
山西省太原市晋阳街南一条10号,山西省太原市晋阳街南一条10号,山西,"Shanxi Zhangze Electric Power Co., Ltd.",电力（IV）,225373.78,1.0,1997-06-08 16:00:00,22.54,深圳证券交易所,山西漳泽电力股份有限公司,1997-05-21 16:00:00,22.54,1993-02-07 16:00:00,91.28,漳泽电力,000767,http://www.zhangzepower.com
江苏省苏州市吴江区芦墟镇318国道72K北侧,江苏省吴江市芦墟镇汾湖经济技术开发区,江苏,"Jiang Su Etern Co., Ltd.",电子电气组件与设备,94499.31,1.0,1997-09-28 16:00:00,7.62,上海证券交易所,江苏永鼎股份有限公司,1997-09-14 16:00:00,9.45,1994-06-29 16:00:00,91.2,永鼎股份,600105,http://www.yongding.com.cn
山西省晋城市凤台东街2288号,山西省晋城市凤台东街2288号兰花科技大厦,山西,"Shanxi Lanhua Sci-tech Venture Co., Ltd.",煤炭开采,114240.0,1.0,1998-12-16 16:00:00,11.42,上海证券交易所,山西兰花科技创业股份有限公司,1998-11-11 16:00:00,11.42,1998-12-07 16:00:00,91.16,兰花科创,600123,http://www.chinalanhua.com
广东省深圳市南山区高新北区科技中二路软件园1栋4楼401、402室,广东省深圳市南山区高新北区科技中二路软件园1栋4楼401、402室,广东,"Shenzhen Kstar Science and Technology Co., Ltd.",电子电气组件与设备,44532.14,1.0,2010-12-06 16:00:00,4.25,中小企业板,深圳科士达科技股份有限公司,2010-11-23 16:00:00,4.45,1993-03-16 16:00:00,91.09,科士达,002518,http://www.kstar.com.cn
北京市海淀区大柳树南村19号,北京市海淀区大柳树南村19号,北京,"Beijing Cisri-gaona Materials and Technology Co., Ltd.",有色金属,41851.24,1.0,2009-12-24 16:00:00,4.18,创业板,北京钢研高纳科技股份有限公司,2009-12-15 16:00:00,4.19,2004-11-21 16:00:00,90.9,钢研高纳,300034,http://www.cisri-gaona.com.cn
浙江省湖州市双林镇镇西,浙江省湖州市双林镇镇西,浙江,"Zhejiang Jiuli Hi-tech Metals Co., Ltd.",钢铁,84150.59,1.0,2009-12-10 16:00:00,8.16,中小企业板,浙江久立特材科技股份有限公司,2009-11-30 16:00:00,8.42,2005-09-18 16:00:00,90.61,久立特材,002318,http://www.jiuli.com
湖北省武汉市武昌南湖周家湾100号,湖北省武汉市武昌南湖周家湾100号,湖北,"Mayinglong Pharmaceutical Group Co., Ltd.",制药,43105.39,1.0,2004-05-16 16:00:00,4.3,上海证券交易所,马应龙药业集团股份有限公司,,4.31,1994-05-08 16:00:00,90.35,马应龙,600993,http://www.mayinglong.cn
天津市西青区京福公路578号,天津市西青区京福公路578号,天津,"Tianjin Faw Xiali Automobile Co., Ltd.",汽车,159517.4,1.0,1999-07-26 16:00:00,15.95,深圳证券交易所,天津一汽夏利汽车股份有限公司,1999-06-27 16:00:00,15.95,1997-08-27 16:00:00,89.97,一汽夏利,000927,http://www.tjfaw.com.cn
吉林省通化市二道江区金马路999号,吉林省通化市二道江区金马路999号,吉林,"Tonghua Golden-horse Pharmaceutical Industry Co., Ltd.",制药,96649.47,1.0,1997-04-29 16:00:00,4.49,深圳证券交易所,通化金马药业集团股份有限公司,,9.66,1993-02-25 16:00:00,89.58,通化金马,000766,http://www.thjm.cn
吉林省吉林市船营区迎宾大路98号,吉林省吉林市高新区吉林大街45-1号,吉林,"Jilin Yongda Group Co., Ltd.",电子电气组件与设备,84000.0,1.0,2011-10-17 16:00:00,7.24,中小企业板,吉林永大集团股份有限公司,2011-10-09 16:00:00,8.4,1998-11-05 16:00:00,89.58,永大集团,002622,http://www.jlydjt.com
黑龙江省哈尔滨开发区迎宾路集中区东湖街9号,黑龙江省哈尔滨开发区迎宾路集中区东湖街9号,黑龙江,"Harbin Boshi Automation Co., Ltd.",工业机械,68170.0,1.0,2012-09-10 16:00:00,5.21,中小企业板,哈尔滨博实自动化股份有限公司,2012-09-02 16:00:00,6.82,1997-09-11 16:00:00,89.12,博实股份,002698,http://www.boshi.cn
江苏省江阴市滨江开发区定山路十号,江苏省江阴市滨江开发区定山路10号,江苏,"Jiangsu Sihuan Bioengineering Co., Ltd.",制药,102955.62,1.0,1993-09-07 16:00:00,10.3,深圳证券交易所,江苏四环生物股份有限公司,,10.3,1992-05-17 16:00:00,88.85,四环生物,000518,http://www.shsw.com.cn
安徽省合肥市经济技术开发区莲花路,安徽省合肥市经济技术开发区莲花路1307号,安徽,"Qiaqia Food Co., Ltd.",食品生产（IV）,50700.0,1.0,2011-03-01 16:00:00,5.07,中小企业板,洽洽食品股份有限公司,2011-02-20 16:00:00,5.07,2001-08-08 16:00:00,88.57,洽洽食品,002557,http://www.qiaqiafood.com
江苏省昆山市黑龙江北路55号,江苏省昆山市黑龙江北路55号,江苏,"WUS Printed Circuit (Kunshan) Co., Ltd.",电子电气组件与设备,167415.98,1.0,2010-08-17 16:00:00,16.73,中小企业板,沪士电子股份有限公司,2010-08-03 16:00:00,16.74,2003-02-23 16:00:00,88.19,沪电股份,002463,http://www.wuscn.com
湖北省鄂州经济开发区吴楚大道18号,湖北省鄂州经济开发区吴楚大道18号,湖北,"Goody Science and Technology Co., Ltd.",通用化工品,34560.0,1.0,2012-08-15 16:00:00,3.04,中小企业板,顾地科技股份有限公司,2012-08-07 16:00:00,3.46,1999-10-17 16:00:00,88.02,顾地科技,002694,http://www.goody.com.cn
湖北省武汉市东湖开发区江夏大道特1号凯迪大厦,湖北省武汉市东湖开发区江夏大道特1号,湖北,"Kaidi Ecological and Environmental Technology Co., Ltd.",电力（IV）,150729.24,1.0,1999-09-22 16:00:00,9.41,深圳证券交易所,凯迪生态环境科技股份有限公司,1999-07-21 16:00:00,15.07,1999-08-01 16:00:00,88.0,凯迪生态,000939,http://www.china-kaidi.com
浙江省嘉兴市嘉兴工业园区步焦路,浙江省嘉兴市嘉兴工业园区步焦路,浙江,"Zhejiang Satellite Petro Chemical Co., Ltd.",特种化工品,80000.0,1.0,2011-12-27 16:00:00,8.0,中小企业板,浙江卫星石化股份有限公司,2011-12-15 16:00:00,8.0,2005-08-02 16:00:00,87.52,卫星石化,002648,http://www.satlpec.com
浙江省诸暨市店口镇露笑路38号,浙江省诸暨市店口镇露笑路38号,浙江,"Roshow Technology Co., Ltd.",有色金属,73482.48,1.0,2011-09-19 16:00:00,5.6,中小企业板,露笑科技股份有限公司,2011-09-07 16:00:00,7.35,1989-05-23 15:00:00,87.43,露笑科技,002617,http://www.roshowtech.com
广东省深圳市大工业区兰竹大道以北CH3主厂房,广东省深圳市大工业区兰竹东路23号,广东,"Shenzhen Huakong Seg Co., Ltd.",电子电气组件与设备,100667.15,1.0,1997-06-10 16:00:00,8.97,深圳证券交易所,深圳华控赛格股份有限公司,1997-05-20 16:00:00,10.07,1997-06-05 16:00:00,87.34,华控赛格,000068,http://www.ssg.com.cn
青海省西宁经济开发区金桥路38号,陕西省西安市高新区高新六路52号立人科技园A座六层,青海,"GuangYuYuan Chinese Herbal Medicine Co., Ltd.",制药,27780.84,1.0,1996-11-04 16:00:00,2.44,上海证券交易所,广誉远中药股份有限公司,,2.78,1996-11-24 16:00:00,87.14,广誉远,600771,http://www.guangyuyuan.cn
上海市浦东新区建陆路378号,上海市静安区北京西路1320号,上海,"Shanghai Modern Pharmaceutical Co., Ltd.",制药,28773.34,1.0,2004-06-15 16:00:00,2.88,上海证券交易所,上海现代制药股份有限公司,,2.88,2000-12-19 16:00:00,86.87,现代制药,600420,http://www.shyndec.com
河南省巩义市新华路31号,河南省巩义市新华路31号,河南,"Henan Zhongfu Industry Co., Ltd.",铝业,174154.04,1.0,2002-06-25 16:00:00,15.15,上海证券交易所,河南中孚实业股份有限公司,,17.42,1993-12-09 16:00:00,86.8,中孚实业,600595,http://www.zfsy.com.cn
重庆市万州区高笋塘85号,重庆市渝中区邹容路68号大都会商厦3611室,重庆,"Chongqing Three Gorges Water Conservancy and Electric Power Co., Ltd.",电力（IV）,99300.55,1.0,1997-08-03 16:00:00,8.88,上海证券交易所,重庆三峡水利电力（集团）股份有限公司,1997-07-22 16:00:00,9.93,1994-04-27 16:00:00,86.58,三峡水利,600116,http://www.cqsxsl.com
安徽省来安县城东大街127号,安徽省来安县城东大街127号,安徽,"Anhui Jinhe Industrial Co., Ltd.",通用化工品,56459.84,1.0,2011-07-06 16:00:00,5.54,中小企业板,安徽金禾实业股份有限公司,2011-06-28 16:00:00,5.65,2006-12-24 16:00:00,86.42,金禾实业,002597,http://www.jinheshiye.com
北京市海淀区西直门北大街42号节能大厦A座12层,北京市海淀区西直门北大街42号节能大厦A座12层,北京,CECEP Wind-Power Corporation,电力（IV）,207778.0,1.0,2014-09-28 16:00:00,8.18,上海证券交易所,中节能风力发电股份有限公司,2014-09-17 16:00:00,20.78,2006-01-05 16:00:00,86.28,节能风电,601016,http://www.cecwpc.cn
河南省郑州市经济技术开发区第九大街167号,河南省郑州市经济技术开发区第九大街167号,河南,"Zhengzhou Coal Mining Machinery Group Co., Ltd.",工业机械,162112.2,1.0,2010-08-02 16:00:00,13.78,上海证券交易所,郑州煤矿机械集团股份有限公司,2010-07-19 16:00:00,16.21,2008-12-27 16:00:00,86.26,郑煤机,601717,http://www.zzmj.com
湖南省岳阳市岳阳楼区城陵矶光明路,湖南省岳阳市城陵矶洪家洲,湖南,"Yueyang Forest and Paper Co., Ltd.",造纸,104315.91,1.0,2004-05-24 16:00:00,10.43,上海证券交易所,岳阳林纸股份有限公司,,10.43,2000-09-27 16:00:00,86.06,岳阳林纸,600963,http://www.yypaper.com
湖南省长沙市宁乡县经济技术开发区站前路,湖南省长沙市国家级宁乡经济技术开发区三环北路与谐园路交汇处,湖南,"Jiajia Food Group Co., Ltd.",食品生产（IV）,115200.0,1.0,2012-01-05 16:00:00,11.27,中小企业板,加加食品集团股份有限公司,2011-12-25 16:00:00,11.52,1996-08-02 16:00:00,85.9,加加食品,002650,http://www.jiajiagroup.com
贵州省贵阳市乌当区新添大道北段268号,贵州省贵阳市乌当区新添大道北段268号,贵州,"China Zhenhua (Group) Science and Technology Co., Ltd.",电子电气组件与设备,46934.22,1.0,1997-07-02 16:00:00,4.29,深圳证券交易所,中国振华(集团)科技股份有限公司,1997-06-16 16:00:00,4.69,1997-06-25 16:00:00,85.83,振华科技,000733,http://www.czst.com.cn
浙江省温岭市经济开发区,浙江省温岭市经济开发区,浙江,"Zhejiang Qianjiqng Motorycle Co., Ltd.",汽车,45353.6,1.0,1999-05-13 16:00:00,4.53,深圳证券交易所,浙江钱江摩托股份有限公司,1999-03-10 16:00:00,4.54,1999-03-27 16:00:00,85.79,*ST钱江,000913,http://www.qjmotor.com
河南省焦作市中站区西,河南省焦作市中站区焦克路,河南,"Henan Billions Chemicals Co., Ltd.",通用化工品,203216.47,1.0,2011-07-14 16:00:00,5.96,中小企业板,河南佰利联化学股份有限公司,2011-07-05 16:00:00,20.32,2002-06-30 16:00:00,85.75,佰利联,002601,http://www.billionschem.com
宁夏回族自治区石嘴山市惠农区河滨街,宁夏回族自治区石嘴山市惠农区河滨街,宁夏,"Ningxia Xinri Hengli Steel Wire Rope Co., Ltd.",钢铁,68488.38,1.0,1998-05-28 16:00:00,6.85,上海证券交易所,宁夏新日恒力钢丝绳股份有限公司,1998-04-26 16:00:00,6.85,1998-05-13 16:00:00,85.34,新日恒力,600165,http://www.nxhengli.com.cn
广东省佛山市文沙路16号,广东省佛山市文沙路16号,广东,Foshan Haitian Flavouring and Food Company Ltd.,食品生产（IV）,270495.07,1.0,2014-02-10 16:00:00,2.72,上海证券交易所,佛山市海天调味食品股份有限公司,2014-01-23 16:00:00,27.05,1995-08-29 16:00:00,85.27,海天味业,603288,http://www.haitian-food.com
海南省海口市金盘工业区金盘路12-8号,海南省海口市金盘工业区金牛路2号,海南,"Haima Automobile Group Co., Ltd.",汽车,164463.64,1.0,1994-08-07 16:00:00,16.42,深圳证券交易所,海马汽车集团股份有限公司,1994-06-24 16:00:00,16.45,1993-01-01 16:00:00,85.22,海马汽车,000572,http://www.000572.com
江苏省无锡市新区鸿山街道后宅,江苏省无锡市新区鸿山街道后宅,江苏,"Yinbang Clad Material Co., Ltd.",有色金属,82192.0,1.0,2012-07-17 16:00:00,7.08,创业板,银邦金属复合材料股份有限公司,2012-07-09 16:00:00,8.22,1998-08-24 16:00:00,85.11,银邦股份,300337,http://www.cn-yinbang.com
吉林省通化市柳河县英利路88号,吉林省长春市南关区东头道街137号,吉林,"Jilin Zixin Pharmaceutical Industrial Co., Ltd.",制药,128075.98,1.0,2007-03-01 16:00:00,10.25,中小企业板,吉林紫鑫药业股份有限公司,2007-02-07 16:00:00,12.81,2001-02-22 16:00:00,85.11,紫鑫药业,002118,http://www.jilinzixin.com.cn
浙江省绍兴县柯岩街道余渚村,浙江省绍兴县柯岩街道余渚村,浙江,Sanlux Co.Ltd.,工业机械,65656.97,1.0,2008-04-24 16:00:00,4.72,中小企业板,三力士股份有限公司,2008-04-14 16:00:00,6.57,2002-11-10 16:00:00,85.03,三力士,002224,http://www.v-belt.com
浙江省杭州市萧山经济技术开发区,浙江省杭州市萧山经济技术开发区红垦农场,浙江,"Hangxiao Steel Structure Co.,Ltd",建材与构件,105714.94,1.0,2003-11-09 16:00:00,8.03,上海证券交易所,杭萧钢构股份有限公司,,10.57,1999-12-19 16:00:00,84.93,杭萧钢构,600477,http://www.hxss.com.cn
江苏省宜兴市西郊工业园振丰东路999号,江苏省宜兴市西郊工业园振丰东路999号,江苏,"Jiangsu Zhongchao Holding CO.,LTD.",电子电气组件与设备,126800.0,1.0,2010-09-09 16:00:00,12.58,中小企业板,江苏中超控股股份有限公司,2010-08-29 16:00:00,12.68,2008-06-25 16:00:00,84.9,中超控股,002471,http://www.zcdlgf.com
山东省沂南县县城振兴路6号,山东省济南市经十路17703号华特广场,山东,"Shandong Shanda Wit Science and Technology Co., Ltd.",制药,18025.5,1.0,1999-06-08 16:00:00,1.79,深圳证券交易所,山东山大华特科技股份有限公司,1999-04-11 16:00:00,1.8,1993-06-25 16:00:00,84.9,山大华特,000915,http://www.sd-wit.com
山东省烟台经济技术开发区黑龙江路10号,山东省烟台经济技术开发区黑龙江路10号,山东,"Yantai Tayho Advanced Materials Co., Ltd.",通用化工品,61083.36,1.0,2008-06-24 16:00:00,6.11,中小企业板,烟台泰和新材料股份有限公司,2008-06-15 16:00:00,6.11,1993-05-19 16:00:00,84.87,泰和新材,002254,http://www.tayho.com.cn
湖南省长沙经济技术开发区盼盼路9号,湖南省长沙经济技术开发区盼盼路9号,湖南,"Hunan Chinasun Pharmaceutical Machinery Co., Ltd.",工业机械,36143.49,1.0,2011-05-10 16:00:00,2.67,创业板,湖南千山制药机械股份有限公司,2011-05-02 16:00:00,3.61,2002-10-23 16:00:00,84.84,千山药机,300216,http://www.chinasun.com.cn
辽宁省大连市西岗区八一路169号,辽宁省大连市西岗区八一路169号,辽宁,"Dalian Huarui Heavy Industry Group Co., Ltd.",工业机械,193137.0,1.0,2008-01-15 16:00:00,19.31,中小企业板,大连华锐重工集团股份有限公司,2008-01-02 16:00:00,19.31,1999-07-12 16:00:00,84.79,大连重工,002204,http://www.dhidcw.com
江苏省江阴市华西村,江苏省江阴市华西村南苑宾馆9号楼,江苏,"Jiangsu Huaxicun Co., Ltd.",通用化工品,88601.29,1.0,1999-08-09 16:00:00,7.48,深圳证券交易所,江苏华西村股份有限公司,1999-07-12 16:00:00,8.86,1993-11-30 16:00:00,84.43,华西股份,000936,http://www.jshuaxicun.com、www.v-capital.cn
浙江省东阳市横店江南路333号,浙江省东阳市横店江南路333号,浙江,"Apeloa Pharmaceutical Co., Ltd.",制药,114686.93,1.0,1997-05-08 16:00:00,10.6,深圳证券交易所,普洛药业股份有限公司,,11.47,1997-05-05 16:00:00,84.38,普洛药业,000739,http://www.apeloa.com
辽宁省抚顺市望花区和平路东段56号,辽宁省抚顺市望花区鞍山路东段8号,辽宁,"Fushun Special Steel Co., Ltd.",钢铁,130000.0,1.0,2000-12-28 16:00:00,11.3,上海证券交易所,抚顺特殊钢股份有限公司,2000-12-12 16:00:00,13.0,1999-06-06 16:00:00,84.16,抚顺特钢,600399,http://www.fs-ss.com
安徽省桐城市区快活岭,安徽省桐城市经济开发区东环路1号,安徽,Anhui Shengyun Environment-Protection group Co. Ltd,工业机械,131995.29,1.0,2010-06-24 16:00:00,7.87,创业板,安徽盛运环保(集团)股份有限公司,2010-06-10 16:00:00,13.2,2004-06-06 16:00:00,84.13,盛运环保,300090,http://www.300090.com.cn
广东省广州市黄埔区云埔工业区东诚片康达路8号,广东省广州市黄埔区云埔工业区东诚片康达路8号,广东,"Guangzhou Tinci Materials Technology Co., Ltd.",通用化工品,32535.96,1.0,2014-01-22 16:00:00,1.44,中小企业板,广州天赐高新材料股份有限公司,2014-01-12 16:00:00,3.25,2000-06-05 16:00:00,84.06,天赐材料,002709,http://www.tinci.com
北京市海淀区紫竹院路81号院3号楼北方地产,北京市海淀区紫竹院路81号院3号楼北方地产大厦618,北京,"Sino Geophysical Co., Ltd.",采油设备与服务,32000.0,1.0,2011-03-15 16:00:00,2.07,创业板,潜能恒信能源技术股份有限公司,2011-03-06 16:00:00,3.2,2003-11-09 16:00:00,83.99,潜能恒信,300191,http://www.sinogeo.com
江西省新余市冶金路,江西省新余市冶金路,江西,"Xinyu Iron and Steel Co., Ltd.",钢铁,278689.62,1.0,1996-12-24 16:00:00,27.87,上海证券交易所,新余钢铁股份有限公司,1996-12-08 16:00:00,27.87,1996-12-18 16:00:00,83.89,新钢股份,600782,http://www.xinsteel.com.cn
浙江省台州市椒江区前所信质路28号,浙江省台州市椒江区前所信质路28号,浙江,"Xin Zhi Motor Co., Ltd.",工业机械,40002.0,1.0,2012-03-15 16:00:00,3.21,中小企业板,信质电机股份有限公司,2012-03-04 16:00:00,4.0,1990-07-13 15:00:00,83.79,信质电机,002664,http://www.chinaxinzhi.com
江苏省无锡市玉祁镇工业园,江苏省无锡市玉祁镇玉龙路15号,江苏,"Jiangsu Yulong Steel Pipe Co., Ltd.",钢铁,78466.48,1.0,2011-11-06 16:00:00,7.83,上海证券交易所,江苏玉龙钢管股份有限公司,2011-10-26 16:00:00,7.85,1999-12-21 16:00:00,83.78,玉龙股份,601028,http://www.yulongsteelpipe.com
陕西省宝鸡市钛城路1号,陕西省宝鸡市钛城路1号,陕西,"Baoji Titanium Industry Co., Ltd.",有色金属,43026.57,1.0,2002-04-11 16:00:00,4.3,上海证券交易所,宝鸡钛业股份有限公司,2002-03-27 16:00:00,4.3,1999-07-20 16:00:00,83.77,宝钛股份,600456,http://www.baoti.com
陕西省汉中市经济开发区北区鑫源路,陕西省西安市高新技术产业开发区西部大道166号,陕西,"Zhonghang Electronic Measuring Instruments Co., Ltd.",电子电气组件与设备,39384.03,1.0,2010-08-26 16:00:00,3.04,创业板,中航电测仪器股份有限公司,2010-08-15 16:00:00,3.94,2002-12-24 16:00:00,83.53,中航电测,300114,http://www.zemic.com.cn
山东省临沂市临沭县城常林东大街东首,山东省临沂市临沭县城常林东大街东首,山东,"Stanley Agricultural Group Co., Ltd.",特种化工品,116508.72,1.0,2011-06-09 16:00:00,7.11,中小企业板,史丹利化肥股份有限公司,2011-05-31 16:00:00,11.65,1998-07-14 16:00:00,83.3,史丹利,002588,http://www.shidanli.cn
浙江省湖州市和孚镇工业园区,浙江省湖州市和孚镇工业园区,浙江,"Zhejiang Unifull Industrial Fiber Co., Ltd.",通用化工品,39815.47,1.0,2010-06-07 16:00:00,3.98,中小企业板,浙江尤夫高新纤维股份有限公司,2010-05-25 16:00:00,3.98,2008-12-07 16:00:00,83.29,尤夫股份,002427,http://www.unifull.com
湖南省湘潭国家高新技术产业开发区德国工业园莱茵路1号,四川省成都市新都区龙桥镇,湖南,"Hunan Jiangnan Red Arrow Co., Ltd.",建材与构件,103322.42,1.0,1993-10-07 16:00:00,5.83,深圳证券交易所,湖南江南红箭股份有限公司,,10.33,1988-08-17 15:00:00,83.12,江南红箭,000519,http://www.yhdle.com
江苏省连云港经济技术开发区江宁工业城,江苏省连云港市新浦区海昌南路58号,江苏,"Jiangsu Kanion Pharmaceutical Co., Ltd.",制药,61644.91,1.0,2002-09-17 16:00:00,4.42,上海证券交易所,江苏康缘药业股份有限公司,,6.16,1996-05-07 16:00:00,83.05,康缘药业,600557,http://www.kanion.com
浙江省嘉兴市嘉善经济开发区晋亿大道8号,浙江省嘉兴市嘉善经济开发区晋亿大道8号,浙江,"Gem-year Industrial Co., Ltd.",工业机械,79269.0,1.0,2007-01-25 16:00:00,7.93,上海证券交易所,晋亿实业股份有限公司,2007-01-11 16:00:00,7.93,1995-11-16 16:00:00,82.99,晋亿实业,601002,http://www.GEM-YEAR.com
江苏省太仓市浮桥镇沪浮璜公路88号,江苏省太仓市浮桥镇沪浮璜公路88号,江苏,"Yechiu Metal Recycling (China) Co., Ltd.",铝业,202540.0,1.0,2012-04-22 16:00:00,20.25,上海证券交易所,怡球金属资源再生(中国)股份有限公司,2012-04-08 16:00:00,20.25,2001-03-14 16:00:00,82.64,怡球资源,601388,http://www.yechiu.com.cn
浙江省杭州市萧山经济技术开发区,浙江省杭州市萧山经济技术开发区,浙江,"Zhejiang Transfar Co., Ltd.",特种化工品,325781.47,1.0,2004-06-28 16:00:00,4.13,中小企业板,浙江传化股份有限公司,,32.58,2001-07-05 16:00:00,82.56,传化股份,002010,http://www.transfarchem.com
江苏省南京经济技术开发区恒通大道19-1号,江苏省南京市栖霞区天佑路7号,江苏,Nanjing Huadong Electronics Information and Technology Company Limited,电子电气组件与设备,452956.7,1.0,1997-05-19 16:00:00,24.42,深圳证券交易所,南京华东电子信息科技股份有限公司,,45.3,1997-05-13 16:00:00,82.55,华东科技,000727,http://www.hdeg.com
山东省青岛即墨市青岛环保产业园,山东省青岛市香港中路18号福泰广场B座24-25楼,山东,"Qingdao Kingking Applied Chemistry Co., Ltd.",通用化工品,37724.52,1.0,2006-12-14 16:00:00,3.22,中小企业板,青岛金王应用化学股份有限公司,2006-12-03 16:00:00,3.77,1997-03-02 16:00:00,82.46,青岛金王,002094,http://www.chinakingking.com
重庆市涪陵区太极大道1号,重庆市涪陵区太极大道1号,重庆,"Chongqing Taiji Industry (Group) Co., Ltd.",制药,42689.4,1.0,1997-11-17 16:00:00,4.27,上海证券交易所,重庆太极实业股份有限公司,,4.27,1993-11-17 16:00:00,82.43,太极集团,600129,http://www.taiji.com
北京市海淀区上地信息产业基地四街9号,北京市海淀区上地信息产业基地四街9号,北京,"Beijing Sifang Automation Co., Ltd.",电子电气组件与设备,81317.2,1.0,2010-12-30 16:00:00,8.13,上海证券交易所,北京四方继保自动化股份有限公司,2010-12-23 16:00:00,8.13,1994-04-07 16:00:00,82.29,四方股份,601126,http://www.sf-auto.com
