addrReg,addrWork,area,ename,industry,institutional,is_target,listingDate,lootchips,market,name,offerDate,pricelimit,registerDate,shareholders,sname,stockCode,webSite
重庆市长寿区化南一路1号,重庆市长寿区化南一路1号,重庆,"Fuan Pharmaceutical (Group) co.,Ltd.",制药,39657.08,1.0,2011-03-21 16:00:00,1.59,创业板,福安药业(集团)股份有限公司,2011-03-13 16:00:00,3.97,2004-02-24 16:00:00,38.55,福安药业,300194,http://www.fapharm.com
湖南省常德市德山开发区崇德路金健米业总部,湖南省常德市德山开发区崇德路金健米业总部,湖南,"JinJian Cereals Industry Co., Ltd.",食品生产（IV）,64178.32,1.0,1998-05-05 16:00:00,5.44,上海证券交易所,金健米业股份有限公司,,6.42,1998-04-26 16:00:00,38.55,金健米业,600127,http://www.jjmy.cn
四川省成都高新区科园南二路二号,四川省成都高新区科园南二路二号,四川,"Sichuan Yimikang Environmental Tech. Co., Ltd.",工业机械,43993.19,1.0,2011-08-02 16:00:00,2.78,创业板,四川依米康环境科技股份有限公司,2011-07-24 16:00:00,4.4,2002-09-11 16:00:00,38.54,依米康,300249,http://www.sunrisegroup.com.cn
陕西省西安市高新技术产业开发区科技四路20,陕西省西安市高新技术产业开发区科技四路202号,陕西,Ginwa Enterprise (Group) Inc.,制药,30529.59,1.0,1997-06-11 16:00:00,3.05,上海证券交易所,金花企业（集团）股份有限公司,,3.05,1996-02-13 16:00:00,38.53,金花股份,600080,http://www.ginwa.com.cn
广东省广州市黄埔区云埔工业区埔南路51号,广东省广州市黄埔区云埔工业区埔南路51号,广东,"Guangzhou Zhiguang Electric Co., Ltd.",电子电气组件与设备,39389.6,1.0,2007-09-18 16:00:00,1.89,中小企业板,广州智光电气股份有限公司,2007-09-06 16:00:00,3.94,2005-12-20 16:00:00,38.47,智光电气,002169,http://www.gzzg.com.cn
浙江省丽水生态产业集聚区(经济开发区)石牛路73号,浙江省丽水市天宁工业区24号,浙江,Zhejiang Founder Motor Limited Company,工业机械,26523.51,1.0,2007-12-11 16:00:00,1.25,中小企业板,浙江方正电机股份有限公司,2007-11-29 16:00:00,2.65,2001-12-19 16:00:00,38.47,方正电机,002196,http://www.fdm.com.cn
山东省寿光市北环路99号,山东省寿光市北环路99号,山东,"Shandong Molong Petroleum Machinery Co., Ltd.",工业机械,79784.84,1.0,2010-10-20 16:00:00,3.0,中小企业板,山东墨龙石油机械股份有限公司,2010-10-10 16:00:00,7.98,2001-12-29 16:00:00,38.39,山东墨龙,002490,http://www.molonggroup.com
云南省保山市隆阳区汉庄镇小堡子,云南省昆明市官渡区春城路219号东航投资大厦806室,云南,"Yunnan Bowin Technology Industry Co., Ltd.",建材与构件,23608.8,1.0,1995-12-07 16:00:00,2.36,上海证券交易所,云南博闻科技实业股份有限公司,,2.36,1990-06-04 15:00:00,38.27,博闻科技,600883,http://www.ynbowin.com
广东省深圳市南山区高新区中区麻雀岭工业区M-6栋三层二区,广东省深圳市南山区深圳市软件产业基地1栋A座13层,广东,"Shenzhen Success Electronics Co., Ltd.",电子电气组件与设备,18683.58,1.0,2009-09-02 16:00:00,1.47,中小企业板,深圳市宇顺电子股份有限公司,2009-08-23 16:00:00,1.87,2007-04-02 16:00:00,38.26,*ST宇顺,002289,http://www.szsuccess.com.cn
河南省濮阳县西环路中段,河南省濮阳县西环路中段,河南,"Puyang Refractories Group Co., Ltd.",建材与构件,88086.83,1.0,2008-04-24 16:00:00,5.75,中小企业板,濮阳濮耐高温材料(集团)股份有限公司,2008-04-14 16:00:00,8.81,2002-01-27 16:00:00,38.2,濮耐股份,002225,http://www.punai.com
江苏省苏州市相城区潘阳工业园春丰路88号,江苏省苏州市相城区潘阳工业园春丰路88号,江苏,"Suzhou Yangtze New Materials Co., Ltd.",有色金属,32004.0,1.0,2012-01-18 16:00:00,2.6,中小企业板,苏州扬子江新型材料股份有限公司,2012-01-10 16:00:00,3.2,2002-11-26 16:00:00,38.19,扬子新材,002652,http://www.yzjnm.com
云南省昆明市高新区科高路2188号,云南省昆明市高新区科高路2188号,云南,"Kunming Longjin Pharmaceutical Co., Ltd.",制药,40050.0,1.0,2015-03-23 16:00:00,2.25,中小企业板,昆明龙津药业股份有限公司,2015-03-11 16:00:00,4.01,1996-09-15 16:00:00,38.18,龙津药业,002750,http://www.longjin.com.cn
广东省佛山市南海区小塘狮山新城开发区,广东省佛山市南海区狮山镇松岗虹岭二路386号,广东,"Guangdong Delian (Group) Co., Ltd.",通用化工品,75432.93,1.0,2012-03-26 16:00:00,4.44,中小企业板,广东德联集团股份有限公司,2012-03-13 16:00:00,7.54,1992-01-23 16:00:00,38.15,德联集团,002666,http://www.delian.cn
浙江省三门县海游镇西区大道369号,浙江省三门县海游镇西区大道369号,浙江,"Sanbian Sci Tech Co., Ltd.",电子电气组件与设备,20160.0,1.0,2007-02-07 16:00:00,1.83,中小企业板,三变科技股份有限公司,2007-01-25 16:00:00,2.02,2001-12-28 16:00:00,38.14,三变科技,002112,http://www.sanbian.cn
湖北省应城市东马坊团结大道26号,湖北省应城市东马坊团结大道26号,湖北,"Hubei Shuanghuan Science and Technology Stock Co., Ltd.",通用化工品,46414.58,1.0,1997-04-14 16:00:00,4.64,深圳证券交易所,湖北双环科技股份有限公司,1997-04-02 16:00:00,4.64,1993-03-27 16:00:00,38.06,双环科技,000707,http://www.hbshkj.cn
山西省太原市万柏林区开城街一号,山西省太原市万柏林区开城街一号,山西,"Taiyuan Lionhead Cement Co., Ltd.",建材与构件,23000.0,1.0,2001-08-23 16:00:00,2.3,上海证券交易所,太原狮头水泥股份有限公司,2001-07-31 16:00:00,2.3,1999-02-27 16:00:00,37.84,狮头股份,600539,http://www.600539.com.cn
广东省深圳市坪山新区坪山锦龙大道西侧,广东省深圳市坪山新区坪山锦龙大道西侧,广东,"Shenzhen Changhong Technology Co., Ltd.",工业机械,50250.0,1.0,2010-12-21 16:00:00,2.84,创业板,深圳市昌红模具科技股份有限公司,2010-12-12 16:00:00,5.03,2001-04-10 16:00:00,37.83,昌红科技,300151,http://www.sz-changhong.com
新疆维吾尔自治区克拉玛依市友谊路251号,新疆维吾尔自治区阜康准东石油基地,新疆,"Xinjiang Zhundong Petroleum Technology Co., Ltd.",石油勘探与开采,23917.74,1.0,2008-01-27 16:00:00,1.77,中小企业板,新疆准东石油技术股份有限公司,2008-01-16 16:00:00,2.39,2003-12-28 16:00:00,37.82,准油股份,002207,http://www.zygf.com.cn
福建省厦门火炬高新区（翔安）产业区翔天路259-269号,福建省厦门火炬高新区（翔安）产业区翔岳路19号,福建,"Xiamen Changelight Co., Ltd.",电子电气组件与设备,70455.33,1.0,2010-08-11 16:00:00,4.13,创业板,厦门乾照光电股份有限公司,2010-08-01 16:00:00,7.05,2006-02-20 16:00:00,37.72,乾照光电,300102,http://www.changelight.com.cn
黑龙江省大庆高新技术产业开发区,黑龙江省大庆高新技术产业开发区建设路239号,黑龙江,Daqing Huake Company Limited,通用化工品,12963.95,1.0,2000-07-25 16:00:00,1.3,深圳证券交易所,大庆华科(集团)股份有限公司,2000-07-06 16:00:00,1.3,1998-12-07 16:00:00,37.69,大庆华科,000985,http://www.huake.com
北京市丰台区科学城富丰路6号,北京市丰台区科学城富丰路6号,北京,"Beijing Aritime Intelligent Control Co., Ltd.",工业机械,22364.55,1.0,2002-09-18 16:00:00,2.24,上海证券交易所,北京金自天正智能控制股份有限公司,,2.24,1999-12-27 16:00:00,37.53,金自天正,600560,http://www.aritime.com
山东省胶州市广州北路318号,山东省胶州市广州北路318号,山东,"Qingdao East Steel Tower Stock Co., Ltd.",建材与构件,78075.0,1.0,2011-02-10 16:00:00,3.42,中小企业板,青岛东方铁塔股份有限公司,2011-01-24 16:00:00,7.81,1996-07-31 16:00:00,37.48,东方铁塔,002545,http://www.qddftt.cn
江苏省南京市六合区瓜埠镇大庙村,江苏省南京市六合区瓜埠镇新材料产业园,江苏,Nanjing Chemical Fibre Company Limited.,通用化工品,30706.93,1.0,1996-03-07 16:00:00,3.07,上海证券交易所,南京化纤股份有限公司,1996-02-05 16:00:00,3.07,1992-09-27 16:00:00,37.46,南京化纤,600889,http://www.ncfc.cn
上海市浦东新区浦建路76号由由国际广场901室,上海市浦东新区浦建路76号由由国际广场901室,上海,"Shanghai Fenghwa Group Co., Ltd.",有色金属,18802.05,1.0,1992-09-09 16:00:00,1.88,上海证券交易所,上海丰华(集团)股份有限公司,,1.88,1992-06-05 16:00:00,37.45,丰华股份,600615,http://www.fenghwa.sh.cn
吉林省长春市朝阳区延安大街1399号,吉林省长春市朝阳区延安大街1399号,吉林,"Jilin Forest Industry Co., Ltd.",建材与构件,31050.0,1.0,1998-10-06 16:00:00,3.11,上海证券交易所,吉林森林工业股份有限公司,1998-09-02 16:00:00,3.11,1998-09-28 16:00:00,37.42,吉林森工,600189,http://www.jlsg.com.cn
河南省新郑市薛店镇,河南省郑州市新郑市薛店镇S102与中华路交叉口北好想你枣业股份有限公司行政中心7楼,河南,"Haoxiangni Jujube Co., Ltd.",食品生产（IV）,25784.21,1.0,2011-05-19 16:00:00,0.98,中小企业板,好想你枣业股份有限公司,2011-05-11 16:00:00,2.58,1997-09-23 16:00:00,37.41,好想你,002582,http://www.haoxiangni.cn
浙江省杭州经济技术开发区6号大街68-1,浙江省杭州经济技术开发区6号大街68-1,浙江,"Hangzhou Cable Co., Ltd",电子电气组件与设备,68687.89,1.0,2015-02-16 16:00:00,2.63,上海证券交易所,杭州电缆股份有限公司,2015-02-09 16:00:00,6.87,2002-04-16 16:00:00,37.3,杭电股份,603618,http://www.hzcables.com
陕西省韩城市煤化工业园,陕西省韩城市煤化工业园,陕西,"Shaanxi Heimao Coking Co., Ltd.",煤炭开采,93000.0,1.0,2014-11-04 16:00:00,4.44,上海证券交易所,陕西黑猫焦化股份有限公司,2014-10-23 16:00:00,9.3,2003-11-17 16:00:00,37.3,陕西黑猫,601015,http://www.heimaocoking.com
广东省深圳市坪山新区大工业区聚龙山3号路,广东省深圳市坪山新区大工业区聚龙山3号路,广东,"SHENZHENCHANGFANG GROUP Co., LTD.",电子电气组件与设备,79036.4,1.0,2012-03-20 16:00:00,4.06,创业板,深圳市长方集团股份有限公司,2012-03-11 16:00:00,7.9,2005-05-29 16:00:00,37.22,长方集团,300301,http://www.cfled.com
浙江省绍兴市越城区人民东路1417号,浙江省绍兴市越城区人民东路1417号,浙江,"Zhejiang Shengyang Science and Technology Co., Ltd.",电子电气组件与设备,22970.0,1.0,2015-04-22 16:00:00,0.96,上海证券交易所,浙江盛洋科技股份有限公司,2015-04-13 16:00:00,2.3,2003-06-09 16:00:00,37.21,盛洋科技,603703,http://www.shengyang.com
河南省林州市产业集聚区凤宝大道与陵阳大道交叉口,河南省林州市经济技术开发区凤宝大道与陵阳大道交叉口,河南,"Linzhou Heavy Machinery Group Co., Ltd.",工业机械,80168.31,1.0,2011-01-10 16:00:00,5.2,中小企业板,林州重机集团股份有限公司,2010-12-28 16:00:00,8.02,2002-05-07 16:00:00,37.15,林州重机,002535,http://www.lzzj.com
内蒙古自治区包头稀土高新技术产业开发区曙,内蒙古自治区包头稀土高新技术产业开发区曙光路22号,内蒙古,"Baotou Tomorrow Technology Co., Ltd.",通用化工品,43741.25,1.0,1997-07-03 16:00:00,3.37,上海证券交易所,包头明天科技股份有限公司,1997-06-12 16:00:00,4.37,1997-06-25 16:00:00,37.12,ST明科,600091,http://www.tomotech.com
福建省南平来舟经济开发区,福建省南平市八一路356号,福建,"Fujian Yuanli Active Carbon Co., Ltd.",通用化工品,13600.0,1.0,2011-01-31 16:00:00,0.74,创业板,福建元力活性炭股份有限公司,2011-01-23 16:00:00,1.36,1999-05-20 16:00:00,37.05,元力股份,300174,http://www.yuanlicarbon.com
江苏省江阴市云亭镇工业园区,江苏省江阴市云亭镇工业园区,江苏,"Jiangsu Baoli International Investment Co., Ltd.",特种化工品,92160.0,1.0,2010-10-25 16:00:00,7.12,创业板,江苏宝利国际投资股份有限公司,2010-10-11 16:00:00,9.22,2007-07-18 16:00:00,36.97,宝利国际,300135,http://www.baolijt.cn
安徽省无为县北门外大街108号,安徽省合肥市包河工业区纬四路16号,安徽,"Anhui Fengyuan Pharmaceutical Co., Ltd.",制药,31214.12,1.0,2000-09-19 16:00:00,3.12,深圳证券交易所,安徽丰原药业股份有限公司,2000-09-06 16:00:00,3.12,1997-08-29 16:00:00,36.97,丰原药业,000153,http://www.bbcayy.com
江苏省扬州市文峰路21号,江苏省扬州市文峰路21号,江苏,"Jiangsu Lianhuan Pharmaceutical Co., Ltd.",制药,21958.17,1.0,2003-03-18 16:00:00,2.2,上海证券交易所,江苏联环药业股份有限公司,,2.2,2000-02-21 16:00:00,36.93,联环药业,600513,http://www.lhpharma.com
浙江省金华市金东经济开发区,浙江省金华市金东经济开发区（傅村镇）,浙江,"Zhejiang Jinlihua Electric Co., Ltd.",电子电气组件与设备,11700.0,1.0,2010-04-20 16:00:00,0.84,创业板,浙江金利华电气股份有限公司,2010-04-07 16:00:00,1.17,2007-12-26 16:00:00,36.9,金利华电,300069,http://www.jlhdq.com
河南省许昌市北郊尚集镇,河南省许昌市北郊尚集镇昌盛路,河南,"Xuchang Yuandong Drive Shaft Co., Ltd.",汽车,56100.0,1.0,2010-05-17 16:00:00,3.97,中小企业板,许昌远东传动轴股份有限公司,2010-05-03 16:00:00,5.61,2007-11-27 16:00:00,36.77,远东传动,002406,http://www.yodonchina.com
新疆维吾尔自治区独山子区大庆东路2号,新疆维吾尔自治区独山子区大庆东路2号,新疆,"Xinjiang Dushanzi Tianli High and New Tech Co., Ltd., P.R.C.",通用化工品,57815.47,1.0,2000-12-24 16:00:00,5.78,上海证券交易所,新疆独山子天利高新技术股份有限公司,2000-12-05 16:00:00,5.78,1999-04-27 16:00:00,36.77,*ST天利,600339,http://www.600339.cc
浙江省宁波市鄞州区启明南路299号,浙江省宁波市鄞州区启明南路299号,浙江,"Ningbo Medicalsystem Biotechnology Co., Ltd.",制药,34762.7,1.0,2015-04-21 16:00:00,1.1,创业板,宁波美康生物科技股份有限公司,2015-04-13 16:00:00,3.48,2003-07-21 16:00:00,36.7,美康生物,300439,http://www.nb-medicalsystem.com
广东省深圳市南山区松白公路百旺信工业园区二区第八栋,广东省深圳市南山区松白公路百旺信工业园区二区第八栋,广东,"Ledman Optoelectronic Co., Ltd.",电子电气组件与设备,34978.72,1.0,2011-01-12 16:00:00,2.05,创业板,深圳雷曼光电科技股份有限公司,2011-01-03 16:00:00,3.5,2004-07-20 16:00:00,36.65,雷曼股份,300162,http://www.ledman.cn
安徽省淮北市东山路,安徽省淮北市东山路148号,安徽,"Anhui Leimingkehua Co., Ltd.",特种化工品,26285.47,1.0,2004-04-27 16:00:00,2.63,上海证券交易所,安徽雷鸣科化股份有限公司,,2.63,1999-03-17 16:00:00,36.62,雷鸣科化,600985,http://www.lmkh.com
浙江省临安市苕溪南路78号,浙江省临安市苕溪南路78号,浙江,"Hangzhou Tian-Mu-Shan Pharmaceutical Enterprise Co., Ltd.",制药,12177.89,1.0,1993-08-22 16:00:00,1.22,上海证券交易所,杭州天目山药业股份有限公司,,1.22,1989-03-12 16:00:00,36.52,天目药业,600671,http://www.hztmyy.com
江苏省江阴市周庄镇云顾路585号,江苏省江阴市周庄镇云顾路585号,江苏,"Jiangyin Haida Rubber and Plastic Co., Ltd.",通用化工品,29334.8,1.0,2012-05-31 16:00:00,2.37,创业板,江阴海达橡塑股份有限公司,2012-05-23 16:00:00,2.93,1998-04-09 16:00:00,36.51,海达股份,300320,http://www.haida.cn
浙江省湖州市杨家埠,浙江省湖州市杨家埠,浙江,"Yongxing Special Stainless Steel Co., Ltd.",钢铁,36000.0,1.0,2015-05-14 16:00:00,1.38,中小企业板,永兴特种不锈钢股份有限公司,2015-05-04 16:00:00,3.6,2000-07-18 16:00:00,36.46,永兴特钢,002756,http://www.yongxingbxg.com
湖北省荆州市东方大道68号,湖北省荆州市东方大道,湖北,"Hubei Feilihua Quartz Glass Co., Ltd.",建材与构件,19680.0,1.0,2014-09-09 16:00:00,1.4,创业板,湖北菲利华石英玻璃股份有限公司,2014-08-27 16:00:00,1.97,2006-04-27 16:00:00,36.46,菲利华,300395,http://www.feilihua.com
广西壮族自治区柳州市东环路282号,广西壮族自治区柳州市东环路282号,广西,"Liuzhou Liangmianzhen Co., Ltd.",通用化工品,55000.0,1.0,2004-01-29 16:00:00,4.5,上海证券交易所,柳州两面针股份有限公司,,5.5,1994-06-29 16:00:00,36.36,两面针,600249,http://www.lmz.com.cn
江苏省新沂经济开发区苏化路1号,江苏省新沂经济开发区苏化路1号,江苏,"Jiangsu Lanfeng Bio-chemical Co., Ltd.",特种化工品,34008.63,1.0,2010-12-02 16:00:00,2.13,中小企业板,江苏蓝丰生物化工股份有限公司,2010-11-21 16:00:00,3.4,2007-09-23 16:00:00,36.32,*ST蓝丰,002513,http://www.jslanfeng.com
广东省深圳市宝安区福永街道桥头社区正中工业厂区7栋1、2、4层厂房、8栋2层,广东省深圳市宝安区福永街道桥头社区正中工业厂区7栋1-5层厂房、8栋2层,广东,"Shenzhen Click Technology Co., Ltd.",电子电气组件与设备,42600.0,1.0,2015-12-21 16:00:00,1.07,中小企业板,深圳可立克科技股份有限公司,2015-12-13 16:00:00,4.26,2004-02-29 16:00:00,36.31,可立克,002782,http://www.clickele.com
陕西省西安市太白南路335号,陕西省西安市太白南路335号,陕西,"Xi'an Typical Industries Co., Ltd.",工业机械,34600.98,1.0,2000-12-12 16:00:00,3.46,上海证券交易所,西安标准工业股份有限公司,2000-11-22 16:00:00,3.46,1999-05-27 16:00:00,36.3,标准股份,600302,http://www.chinatypical.com
湖北省黄石市黄石经济技术开发区黄金山工业新区金山大道398号,湖北省黄石市黄石经济技术开发区黄金山工业新区金山大道398号,湖北,"Hubei Sanfeng Intelligent Conveying Equipment Co., Ltd.",工业机械,37440.0,1.0,2011-11-14 16:00:00,2.0,创业板,湖北三丰智能输送装备股份有限公司,2011-11-02 16:00:00,3.74,1999-09-22 16:00:00,36.27,三丰智能,300276,http://www.cnsanf.com
山西省运城市红旗东街376号,山西省运城市解放路294号,山西,"Nafine Chemical Industry Group Co., Ltd.",通用化工品,54876.0,1.0,1997-04-27 16:00:00,5.49,深圳证券交易所,南风化工集团股份有限公司,1997-04-07 16:00:00,5.49,1996-04-01 16:00:00,36.27,南风化工,000737,http://www.nafine.com
广东省深圳市宝安区观澜街道茜坑社区冠彰厂房第6、7栋,广东省深圳市南山区深南大道9678号大冲商务中心1栋2号楼（B座）28楼,广东,"Shenzhen Soling Industrial Co., Ltd.",电子电气组件与设备,18300.93,1.0,2015-06-10 16:00:00,0.88,中小企业板,深圳市索菱实业股份有限公司,2015-06-02 16:00:00,1.83,1997-10-16 16:00:00,36.24,索菱股份,002766,http://www.szsoling.com
重庆市渝中区解放西路1号望江公寓5楼,北京市海淀区西直门北大街42号节能大厦7层,重庆,"CECEP Solar Energy Co.,Ltd.",电力（IV）,136686.27,1.0,1996-02-07 16:00:00,2.41,深圳证券交易所,中节能太阳能股份有限公司,,13.67,1986-12-31 16:00:00,36.24,太阳能,000591,http://www.cecsec.cn
黑龙江省牡丹江市阳明区光华街恒丰路11号,黑龙江省牡丹江市阳明区光华街恒丰路11号,黑龙江,"Mudanjiang Hengfeng Paper Co., Ltd.",造纸,29873.14,1.0,2001-04-18 16:00:00,2.99,上海证券交易所,牡丹江恒丰纸业股份有限公司,2000-12-19 16:00:00,2.99,1994-03-05 16:00:00,36.18,恒丰纸业,600356,http://www.hengfengpaper.com
北京市昌平区小汤山镇小汤山工业园4号楼,北京市昌平区小汤山工业园,北京,"Beijing Lier High Temperature Materials Co., Ltd.",建材与构件,119855.94,1.0,2010-04-22 16:00:00,6.4,中小企业板,北京利尔高温材料股份有限公司,2010-04-12 16:00:00,11.99,2007-12-27 16:00:00,36.17,北京利尔,002392,http://www.bjlirr.com
广东省江门市新会区会城镇江会路上浅口,广东省江门市新会区会城镇江会路上浅口,广东,"Guangdong Xinhui Meida Nylon Co., Ltd.",通用化工品,52813.96,1.0,1997-06-18 16:00:00,4.03,深圳证券交易所,广东新会美达锦纶股份有限公司,,5.28,1992-11-07 16:00:00,36.13,美达股份,000782,http://www.meidanylon.com
上海市金山区卫清东路1988号,上海市金山区卫清东路1988号,上海,"Shanghai Taisheng Wind Power Equipment Co., Ltd.",工业机械,73151.47,1.0,2010-10-18 16:00:00,4.33,创业板,上海泰胜风能装备股份有限公司,2010-10-07 16:00:00,7.32,2001-04-12 16:00:00,35.87,泰胜风能,300129,http://www.shtsp.com
福建省福州市杨桥路118号宏扬新城建福大厦,福建省福州市鼓楼区琴亭路29号福能方圆大厦,福建,Fujian Cement Inc.,建材与构件,38187.37,1.0,1994-01-02 16:00:00,3.82,上海证券交易所,福建水泥股份有限公司,,3.82,1993-11-26 16:00:00,35.74,福建水泥,600802,http://www.fjcement.com
辽宁省沈阳市浑南新区世纪路55号,沈阳市浑南新区天赐街7-1号曙光大厦A座7层,辽宁,"Shenyang Hejin Holding Co., Ltd.",工业机械,38510.64,1.0,1996-11-11 16:00:00,3.85,深圳证券交易所,沈阳合金股份有限公司,,3.85,1990-03-11 16:00:00,35.61,*ST合金,000633,http://www.hjinv.com
广东省深圳市南山区深南大道高新技术工业村T2厂房T2A6-B,广东省深圳市南山区深南大道高新技术工业村T2厂房T2A6-B,广东,"Shenzhen Aoto Electronics Co., Ltd.",电子电气组件与设备,37843.09,1.0,2011-06-09 16:00:00,2.4,中小企业板,深圳市奥拓电子股份有限公司,2011-05-31 16:00:00,3.78,1993-05-11 16:00:00,35.56,奥拓电子,002587,http://www.szaoto.com.cn
广东省广州市萝岗区云埔一路23号,广东省广州市萝岗区云埔一路23号,广东,"Guangzhou Tech-long Packing Machine Co., Ltd.",工业机械,19524.41,1.0,2008-01-29 16:00:00,1.59,中小企业板,广州达意隆包装机械股份有限公司,2008-01-20 16:00:00,1.95,2006-12-12 16:00:00,35.47,达意隆,002209,http://www.tech-long.com
北京市丰台区南四环西路188号18区23号楼4层,北京市丰台区南四环西路188号18区23号楼4层,北京,"BGRIMM Technology Co., Ltd.",电子电气组件与设备,15220.99,1.0,2004-05-11 16:00:00,1.3,上海证券交易所,北矿科技股份有限公司,,1.52,2000-09-05 16:00:00,35.44,北矿科技,600980,http://www.magmat.com
辽宁省大连市沙河口区西南路888号,辽宁省大连市沙河口区西南路888号,辽宁,"Dalian Refrigeration Co., Ltd.",工业机械,59889.26,1.0,1993-12-07 16:00:00,3.28,深圳证券交易所,大连冷冻机械股份有限公司,,5.99,1993-11-27 16:00:00,35.39,大冷股份,000530,http://www.daleng.cn
江苏省常州市武进高新技术产业开发区龙潜路99号,江苏省常州市武进高新技术产业开发区龙潜路99号,江苏,Jiangsu Hengli Hydraulic CO.，Ltd.,工业机械,63000.0,1.0,2011-10-27 16:00:00,2.47,上海证券交易所,江苏恒立液压股份有限公司,2011-10-18 16:00:00,6.3,2005-06-01 16:00:00,35.36,恒立液压,601100,http://www.hengli-js.com
重庆市北碚区人民村1号,重庆市北碚区人民村1号,重庆,"Chongqing Chuanyi Automation Co., Ltd.",工业机械,39500.0,1.0,2014-08-04 16:00:00,2.31,上海证券交易所,重庆川仪自动化股份有限公司,2014-07-22 16:00:00,3.95,1999-10-31 16:00:00,35.36,川仪股份,603100,http://www.sicc.com.cn
山东省莱芜市钢城区里辛镇张家岭村,山东省莱芜市钢城区里辛镇张家岭村,山东,"Shandong Laiwu Jinlei Wind Power Technology Co., Ltd.",工业机械,11902.84,1.0,2015-04-21 16:00:00,0.56,创业板,山东莱芜金雷风电科技股份有限公司,2015-04-13 16:00:00,1.19,2006-03-23 16:00:00,35.33,金雷风电,300443,http://www.jinleiwind.com
广东省深圳市龙华新区大浪办事处同胜社区赢合产业园1栋1-2层、2栋1-3层,广东省深圳市龙华新区大浪办事处同胜社区赢合产业园1栋1-2层、2栋1-3层,广东,"Shenzhen Yinghe Technology Co., Ltd.",工业机械,11700.0,1.0,2015-05-13 16:00:00,0.53,创业板,深圳市赢合科技股份有限公司,2015-05-04 16:00:00,1.17,2006-06-25 16:00:00,35.17,赢合科技,300457,http://www.yhwins.com/cn
浙江省温岭市大溪镇大洋城工业区,浙江省温岭市大溪镇大洋城工业区,浙江,"Shimge Pump Industry Group Co., Ltd.",工业机械,32116.93,1.0,2010-12-30 16:00:00,2.3,中小企业板,浙江新界泵业股份有限公司,2010-12-21 16:00:00,3.21,1997-11-02 16:00:00,35.16,新界泵业,002532,http://www.shimge.com
云南省曲靖市沾益县盘江镇花山工业区,云南省曲靖市沾益县盘江镇花山工业区,云南,"Yunnan Yunwei Co., Ltd.",通用化工品,61623.5,1.0,1996-07-01 16:00:00,6.16,上海证券交易所,云南云维股份有限公司,,6.16,1996-06-25 16:00:00,35.13,*ST云维,600725,http://www.ywgf.cn
江苏省扬州市江都经济开发区三江大道8号,江苏省江都市浦头镇江灵路1号,江苏,"Jiangsu Changqing Agrichemical Co., Ltd.",特种化工品,35948.62,1.0,2010-04-15 16:00:00,2.2,中小企业板,江苏长青农化股份有限公司,2010-04-05 16:00:00,3.59,2001-01-03 16:00:00,35.09,长青股份,002391,http://www.jscq.com
甘肃省天水市麦积区国家农业科技园区,甘肃省天水市国家农业科技园区,甘肃,"Tianshui Zhongxing Bio-technology Co., Ltd.",食品生产（IV）,37333.07,1.0,2015-06-25 16:00:00,1.58,中小企业板,天水众兴菌业科技股份有限公司,2015-06-16 16:00:00,3.73,2005-11-17 16:00:00,35.05,众兴菌业,002772,http://www.tszxjy.cn
新疆维吾尔自治区乌鲁木齐市林泉西路765号,新疆维吾尔自治区乌鲁木齐市林泉西路765号,新疆,"Xinjiang Guotong Pipeline Co., Ltd.",建材与构件,11615.2,1.0,2008-01-22 16:00:00,1.16,中小企业板,新疆国统管道股份有限公司,2008-01-08 16:00:00,1.16,2001-08-29 16:00:00,35.02,国统股份,002205,http://www.xjgt.com
